{
  "id": "liao2025_agmos2_suppfig49",
  "provenance": {
    "source_type": "source_data",
    "doi": "10.1038/s41467-025-60671-y",
    "citation": "Liao W., Wang J., et al. 'Near-Unity Nitrate to Ammonia conversion via reactant enrichment at the solid-liquid interface', Nat. Commun. (2025)",
    "figure": "Supplementary Fig. 49",
    "file": "41467_2025_60671_MOESM5_ESM.xlsx",
    "sheet": "Supplementary Fig. 49",
    "extraction": "scripts/build_real_datasets.py",
    "notes": "Potential not stated in the Supp. Fig. 49 caption; main-text Fig. 5e and Supp. Fig. 50 use -0.6 V vs RHE in the same H-cell, so -0.6 V is assumed here.",
    "verified_against_figure": false
  },
  "conditions": {
    "catalyst": "Ag-MoS2",
    "electrolyte": "0.5 M K2SO4 + 100 mM KNO3",
    "cell": "H_cell",
    "potential_V_vs_RHE": -0.6,
    "potential_as_reported": "-0.6 V vs RHE",
    "potential_mode": "potentiostatic",
    "pH": null,
    "temperature_C": null,
    "volume_mL": 60,
    "stirring": "not recorded here",
    "c0_mM_N": {
      "NO3": 99.8536
    },
    "notes": "pH not reported for the electrolyte; unbuffered neutral salt, so local and bulk pH likely drift upward as hydroxide is produced. Treat pH as unknown."
  },
  "series": [
    {
      "species": "NO3",
      "t_min": [
        0.0,
        10.0,
        20.0,
        30.0,
        40.0,
        50.0,
        60.0,
        80.0,
        100.0,
        120.0,
        150.0,
        180.0
      ],
      "y": [
        99.8536,
        91.4154,
        81.5057,
        70.2211,
        57.4665,
        44.6646,
        28.8714,
        13.3452,
        5.2237,
        1.8018,
        0.993,
        0.6911
      ],
      "reported_unit": "ug mL-1 as N",
      "conversion": "mM-N = ug N / mL / 14.007"
    },
    {
      "species": "NO2",
      "t_min": [
        0.0,
        10.0,
        20.0,
        30.0,
        40.0,
        50.0,
        60.0,
        80.0,
        100.0,
        120.0,
        150.0,
        180.0
      ],
      "y": [
        0.0,
        1.4421,
        1.9926,
        2.6454,
        3.8049,
        6.6013,
        4.4391,
        3.6344,
        3.1521,
        1.0572,
        0.1413,
        0.0487
      ],
      "reported_unit": "ug mL-1 as N",
      "conversion": "mM-N = ug N / mL / 14.007"
    },
    {
      "species": "NH3",
      "t_min": [
        0.0,
        10.0,
        20.0,
        30.0,
        40.0,
        50.0,
        60.0,
        80.0,
        100.0,
        120.0,
        150.0,
        180.0
      ],
      "y": [
        0.0,
        6.5849,
        16.6975,
        27.6332,
        38.6277,
        48.6815,
        62.3218,
        78.255,
        89.0731,
        95.3641,
        98.1274,
        99.2739
      ],
      "reported_unit": "ug mL-1 as N",
      "conversion": "mM-N = ug N / mL / 14.007"
    }
  ],
  "quality": {
    "n_closure": {
      "t_min": [
        0.0,
        10.0,
        20.0,
        30.0,
        40.0,
        50.0,
        60.0,
        80.0,
        100.0,
        120.0,
        150.0,
        180.0
      ],
      "fraction": [
        1.0,
        0.9959,
        1.0034,
        1.0065,
        1.0005,
        1.0009,
        0.9577,
        0.9537,
        0.9759,
        0.9837,
        0.9941,
        1.0016
      ]
    },
    "flags": [
      "potential_unverified",
      "noisy"
    ]
  }
}
