{
  "id": "chapman2023_fig2_750C",
  "provenance": {
    "source_type": "digitized",
    "citation": "Hu D., Beauvais M. L., Kamm G. E., Mullens B. G., Sanchez Monserrate B. A., Vornholt S. M., Chupas P. J., Chapman K. W., J. Am. Chem. Soc. 145 (2023) 26545-26549",
    "doi": "10.1021/jacs.3c10916",
    "figure": "Fig. 2, 750 C panel",
    "file": "ja3c10916.pdf (not redistributed)",
    "extraction": "Colour classification of the raster Fig. 2 image by scripts/extract_chapman_fig2.py (D. Naumov, commit f135e65; data/digitized_inputs/chapman2023_fig2/extracted_phase_fractions.csv, no manual clicking), then scripts/chapman_to_dataset.py: each grid value is the mean of the 3 extracted 0.05 min columns within 0.051 min of the grid time, because the columns are pixel samples of one drawn curve and using all ~200 would overstate the information; columns before 0.3 min overlap the heating strip, axis line and Li2CO3 label, so the grid starts at 0.3 min and no column with t < 0.3 min is averaged into any value (the 0.3 min point is the mean of the 0.30 and 0.35 min columns only); the grid stops at 9.5 min for every temperature because the last columns of one panel are an edge artefact (details in the converter docstring, not repeated here so that no file carries another temperature's values); Ti fractions converted to formula units per mol Ti (Li4Ti5O12 divided by 5); no t = 0 point.",
    "verified_against_figure": false,
    "notes": "Not yet verified. To do (meta.json): Spot-check 5-10 points per panel against the printed figure (for example Li2TiO3 at 0.5, 1, 2, 5 min and the time anatase reaches zero) and compare reconstruction.png with Fig. 2. Known bias: this panel's extracted Li2TiO3 band reaches 55.4 wt % (at 0.3 min, in the columns used here) against the about 52 wt % maximum stated by the authors, a bias of about 2 wt % most likely from the 1-2 px boundary lines; treat every phase fraction as carrying about 1-2 wt % systematic error. reconstruction.png in the input folder is our re-plot, not the published figure."
  },
  "conditions": {
    "basis": "mol per mol Ti",
    "c0": {
      "anatase": 1.0,
      "Li2CO3": 0.4
    },
    "temperature_C": 750,
    "potential_V_vs_RHE": null,
    "pH": null,
    "precursors": "5:2 TiO2 (anatase):Li2CO3 molar, pelletized, loaded in a capillary",
    "notes": "Sample moved into a pre-heated hot zone; heating takes under 10 s (the 'Heating' strip in the paper's Fig. 3, about the first 0.17 min), and t = 0 is insertion, so the sample is below temperature_C for roughly the first 0.17 min. Atmosphere not stated. c0 is the nominal mix (0.4 Li2CO3 per Ti from the 5:2 molar ratio). Li2CO3 is not a series: the authors state its peaks are no longer distinguishable after about 30 s, and the extraction shows only a ~1-2 wt % line-width strip to the end of the panel, so it appears only in c0."
  },
  "series": [
    {
      "species": "anatase",
      "t_min": [
        0.3,
        0.4,
        0.5,
        0.6,
        0.7,
        0.8,
        1.0,
        1.2,
        1.5,
        2.0,
        2.5,
        3.0,
        3.5,
        4.0,
        5.0,
        6.0,
        7.0,
        8.0,
        9.0,
        9.5
      ],
      "y": [
        0.39515,
        0.3166,
        0.22483,
        0.15467,
        0.10363,
        0.0676,
        0.0265,
        0.00283,
        0.0,
        0.0,
        0.0,
        0.0,
        0.0,
        0.0,
        0.0,
        0.0,
        0.0,
        0.0,
        0.0,
        0.0
      ],
      "reported_unit": "weight % (normalised stack of Rietveld phase fractions)",
      "conversion": "mol per mol Ti = mean(tifrac_anatase) over 3 pixel columns (2 at 0.3 min); tifrac_anatase from wt % with M = 79.866 g/mol, 1 Ti per formula unit"
    },
    {
      "species": "rutile",
      "t_min": [
        0.3,
        0.4,
        0.5,
        0.6,
        0.7,
        0.8,
        1.0,
        1.2,
        1.5,
        2.0,
        2.5,
        3.0,
        3.5,
        4.0,
        5.0,
        6.0,
        7.0,
        8.0,
        9.0,
        9.5
      ],
      "y": [
        0.0443,
        0.1093,
        0.16267,
        0.20857,
        0.24483,
        0.2688,
        0.29577,
        0.31023,
        0.30927,
        0.29947,
        0.29817,
        0.29157,
        0.28577,
        0.27873,
        0.26963,
        0.26197,
        0.25713,
        0.2482,
        0.2406,
        0.24013
      ],
      "reported_unit": "weight % (normalised stack of Rietveld phase fractions)",
      "conversion": "mol per mol Ti = mean(tifrac_rutile) over 3 pixel columns (2 at 0.3 min); tifrac_rutile from wt % with M = 79.866 g/mol, 1 Ti per formula unit"
    },
    {
      "species": "Li2TiO3",
      "t_min": [
        0.3,
        0.4,
        0.5,
        0.6,
        0.7,
        0.8,
        1.0,
        1.2,
        1.5,
        2.0,
        2.5,
        3.0,
        3.5,
        4.0,
        5.0,
        6.0,
        7.0,
        8.0,
        9.0,
        9.5
      ],
      "y": [
        0.47875,
        0.46033,
        0.43977,
        0.42687,
        0.4179,
        0.4107,
        0.39923,
        0.3924,
        0.3735,
        0.35517,
        0.33083,
        0.32153,
        0.3129,
        0.3077,
        0.3012,
        0.2956,
        0.28273,
        0.2854,
        0.28407,
        0.28463
      ],
      "reported_unit": "weight % (normalised stack of Rietveld phase fractions)",
      "conversion": "mol per mol Ti = mean(tifrac_Li2TiO3) over 3 pixel columns (2 at 0.3 min); tifrac_Li2TiO3 from wt % with M = 109.75 g/mol, 1 Ti per formula unit"
    },
    {
      "species": "Li4Ti5O12",
      "t_min": [
        0.3,
        0.4,
        0.5,
        0.6,
        0.7,
        0.8,
        1.0,
        1.2,
        1.5,
        2.0,
        2.5,
        3.0,
        3.5,
        4.0,
        5.0,
        6.0,
        7.0,
        8.0,
        9.0,
        9.5
      ],
      "y": [
        0.01637,
        0.02276,
        0.03454,
        0.04199,
        0.04673,
        0.05058,
        0.0557,
        0.05891,
        0.06345,
        0.06907,
        0.0742,
        0.07738,
        0.08026,
        0.08271,
        0.08582,
        0.08849,
        0.09202,
        0.09328,
        0.09506,
        0.09505
      ],
      "reported_unit": "weight % (normalised stack of Rietveld phase fractions)",
      "conversion": "mol per mol Ti = mean(tifrac_Li4Ti5O12) over 3 pixel columns (2 at 0.3 min) / 5; tifrac_Li4Ti5O12 from wt % with M = 459.08 g/mol, 5 Ti per formula unit"
    }
  ],
  "quality": {
    "flags": [
      "normalised_fractions",
      "extraction_unverified",
      "time_origin_uncertain"
    ],
    "basis_note": "Amounts are formula units per mole of total Ti. The figure plots weight % as a normalised stack (anatase, rutile, Li4Ti5O12, Li2TiO3, Li2CO3 summing to 100); the extraction converted wt % to the fraction of Ti in each Ti-bearing phase with nominal molar masses (TiO2 79.866, Li2TiO3 109.75, Li4Ti5O12 459.08 g/mol; 1, 1, 5 Ti per formula unit), and this converter divides the Li4Ti5O12 Ti fraction by 5. Because the stack is normalised, anatase + rutile + Li2TiO3 + 5 x Li4Ti5O12 = 1 at every point by construction, so a Ti closure check cannot reveal unobserved or amorphous Ti-bearing material. Nominal molar masses were used although the authors report Li-deficient Li2-xTiO3, so the Li2TiO3 amount is approximate. In this panel the Li2TiO3 Ti fraction peaks at 0.479 at 0.3 min on this grid (0.487 at 0.3 min in the 0.05 min columns), above the 0.40 that stoichiometric Li2TiO3 allows with 0.8 Li per Ti in the mix. With nominal stoichiometries (2 Li per Li2TiO3, 4 per Li4Ti5O12) the observed phases would hold 1.02 Li per Ti at 0.8 min and 0.95 at 9.5 min, against 0.8 supplied: either Li2TiO3 is strongly Li-deficient, the extracted Li2TiO3 band is too wide, or the plotted fractions do not balance Li; this dataset cannot tell which."
  }
}
