{
  "id": "liao2025_mos2_suppfig50b",
  "provenance": {
    "source_type": "source_data",
    "doi": "10.1038/s41467-025-60671-y",
    "citation": "Liao W., Wang J., et al. 'Near-Unity Nitrate to Ammonia conversion via reactant enrichment at the solid-liquid interface', Nat. Commun. (2025)",
    "figure": "Supplementary Fig. 50b",
    "file": "41467_2025_60671_MOESM5_ESM.xlsx",
    "sheet": "Supplementary Fig. 50b",
    "extraction": "scripts/build_real_datasets.py",
    "notes": "Catalyst assignment taken from the Supp. Fig. 50 caption ((a) W-MoS2, (b) MoS2); the sheet itself does not name the catalyst. Time column is in hours in the source.",
    "verified_against_figure": false
  },
  "conditions": {
    "catalyst": "MoS2",
    "electrolyte": "0.5 M K2SO4 + 100 mM KNO3",
    "cell": "H_cell",
    "potential_V_vs_RHE": -0.6,
    "potential_as_reported": "-0.6 V vs RHE",
    "potential_mode": "potentiostatic",
    "pH": null,
    "temperature_C": null,
    "volume_mL": 60,
    "stirring": "not recorded here",
    "c0_mM_N": {
      "NO3": 99.95
    },
    "notes": "pH not reported for the electrolyte; unbuffered neutral salt, so local and bulk pH likely drift upward as hydroxide is produced. Treat pH as unknown."
  },
  "series": [
    {
      "species": "NO3",
      "t_min": [
        0.0,
        10.0002,
        19.9998,
        30.0,
        40.0002,
        49.9998,
        60.0,
        79.9998,
        100.0002,
        120.0,
        150.0,
        180.0,
        360.0,
        720.0,
        1080.0,
        1440.0,
        2160.0,
        2880.0
      ],
      "y": [
        99.95,
        95.0663,
        91.0361,
        85.2041,
        80.9842,
        76.2427,
        73.3504,
        67.2339,
        61.9235,
        56.7079,
        50.544,
        45.2336,
        31.104,
        16.4055,
        9.2933,
        6.4484,
        5.5001,
        4.5518
      ],
      "reported_unit": "ug mL-1 as N",
      "conversion": "mM-N = ug N / mL / 14.007"
    },
    {
      "species": "NO2",
      "t_min": [
        0.0,
        10.0002,
        19.9998,
        30.0,
        40.0002,
        49.9998,
        60.0,
        79.9998,
        100.0002,
        120.0,
        150.0,
        180.0,
        360.0,
        720.0,
        1080.0,
        1440.0,
        2160.0,
        2880.0
      ],
      "y": [
        0.0,
        0.5408,
        1.0523,
        1.2715,
        2.2069,
        2.4944,
        2.7574,
        3.1862,
        2.5674,
        1.9244,
        2.1972,
        2.1533,
        2.8451,
        3.3859,
        3.8828,
        3.3469,
        4.0972,
        3.4833
      ],
      "reported_unit": "ug mL-1 as N",
      "conversion": "mM-N = ug N / mL / 14.007"
    },
    {
      "species": "NH3",
      "t_min": [
        0.0,
        10.0002,
        19.9998,
        30.0,
        40.0002,
        49.9998,
        60.0,
        79.9998,
        100.0002,
        120.0,
        150.0,
        180.0,
        360.0,
        720.0,
        1080.0,
        1440.0,
        2160.0,
        2880.0
      ],
      "y": [
        0.0,
        2.9397,
        6.6437,
        9.8774,
        15.0513,
        16.6975,
        18.1674,
        20.6955,
        22.5182,
        23.8704,
        27.5157,
        30.4554,
        42.8714,
        55.2581,
        63.1827,
        65.0389,
        65.5387,
        65.8956
      ],
      "reported_unit": "ug mL-1 as N",
      "conversion": "mM-N = ug N / mL / 14.007"
    }
  ],
  "quality": {
    "n_closure": {
      "t_min": [
        0.0,
        10.0002,
        19.9998,
        30.0,
        40.0002,
        49.9998,
        60.0,
        79.9998,
        100.0002,
        120.0,
        150.0,
        180.0,
        360.0,
        720.0,
        1080.0,
        1440.0,
        2160.0,
        2880.0
      ],
      "fraction": [
        1.0,
        0.986,
        0.9878,
        0.964,
        0.9829,
        0.9548,
        0.9432,
        0.9116,
        0.8705,
        0.8254,
        0.803,
        0.7788,
        0.7686,
        0.7509,
        0.764,
        0.7487,
        0.7517,
        0.7397
      ]
    },
    "flags": [
      "unobserved_sink_suspected"
    ]
  }
}
